ugen0.5: <Belkin Belkin USB 3.0 Hub> at usbus0, cfg=1 md=HOST spd=SUPER (5.0Gbps) pwr=ON (124mA)

  bLength = 0x0012 
  bDescriptorType = 0x0001 
  bcdUSB = 0x0300 
  bDeviceClass = 0x00ff  <Vendor specific>
  bDeviceSubClass = 0x00ff 
  bDeviceProtocol = 0x0000 
  bMaxPacketSize0 = 0x0009 
  idVendor = 0x050d 
  idProduct = 0x0128 
  bcdDevice = 0x0100 
  iManufacturer = 0x0001  <Belkin>
  iProduct = 0x0002  <Belkin USB 3.0 Hub>
  iSerialNumber = 0x0003  <00A0CEC81F7AF5>
  bNumConfigurations = 0x0001 

 Configuration index 0

    bLength = 0x0009 
    bDescriptorType = 0x0002 
    wTotalLength = 0x0039 
    bNumInterfaces = 0x0001 
    bConfigurationValue = 0x0001 
    iConfiguration = 0x0000  <no string>
    bmAttributes = 0x00a0 
    bMaxPower = 0x003e 

    Interface 0
      bLength = 0x0009 
      bDescriptorType = 0x0004 
      bInterfaceNumber = 0x0000 
      bAlternateSetting = 0x0000 
      bNumEndpoints = 0x0003 
      bInterfaceClass = 0x00ff  <Vendor specific>
      bInterfaceSubClass = 0x00ff 
      bInterfaceProtocol = 0x0000 
      iInterface = 0x0004  <Network_Interface>

     Endpoint 0
        bLength = 0x0007 
        bDescriptorType = 0x0005 
        bEndpointAddress = 0x0081  <IN>
        bmAttributes = 0x0003  <INTERRUPT>
        wMaxPacketSize = 0x0008 
        bInterval = 0x000b 
        bRefresh = 0x0000 
        bSynchAddress = 0x0000 

      Additional Descriptor

      bLength = 0x06
      bDescriptorType = 0x30
      bDescriptorSubType = 0x00
       RAW dump: 
       0x00 | 0x06, 0x30, 0x00, 0x00, 0x00, 0x00


     Endpoint 1
        bLength = 0x0007 
        bDescriptorType = 0x0005 
        bEndpointAddress = 0x0082  <IN>
        bmAttributes = 0x0002  <BULK>
        wMaxPacketSize = 0x0400 
        bInterval = 0x0000 
        bRefresh = 0x0000 
        bSynchAddress = 0x0000 

      Additional Descriptor

      bLength = 0x06
      bDescriptorType = 0x30
      bDescriptorSubType = 0x03
       RAW dump: 
       0x00 | 0x06, 0x30, 0x03, 0x00, 0x00, 0x00


     Endpoint 2
        bLength = 0x0007 
        bDescriptorType = 0x0005 
        bEndpointAddress = 0x0003  <OUT>
        bmAttributes = 0x0002  <BULK>
        wMaxPacketSize = 0x0400 
        bInterval = 0x0000 
        bRefresh = 0x0000 
        bSynchAddress = 0x0000 

      Additional Descriptor

      bLength = 0x06
      bDescriptorType = 0x30
      bDescriptorSubType = 0x0f
       RAW dump: 
       0x00 | 0x06, 0x30, 0x0f, 0x00, 0x00, 0x00




