13:50:18.738338 IP (tos 0x0, ttl 63, id 48343, offset 0, flags [DF], proto TCP (6), length 147)
    192.168.0.120.61442 > 172.217.1.174.443: Flags [P.], cksum 0x9bf6 (correct), seq 2157886795:2157886890, ack 4254170330, win 501, options [nop,nop,TS val 582110167 ecr 1624628991], length 95
13:50:18.745634 IP (tos 0x0, ttl 122, id 36768, offset 0, flags [none], proto TCP (6), length 52)
    172.217.1.174.443 > 192.168.0.120.61442: Flags [.], cksum 0x9629 (correct), seq 1, ack 95, win 318, options [nop,nop,TS val 1624634843 ecr 582110167], length 0
13:50:18.765911 IP (tos 0x0, ttl 122, id 36782, offset 0, flags [none], proto TCP (6), length 120)
    172.217.1.174.443 > 192.168.0.120.61442: Flags [P.], cksum 0xf8d7 (correct), seq 1:69, ack 95, win 318, options [nop,nop,TS val 1624634879 ecr 582110167], length 68
13:50:18.765914 IP (tos 0x0, ttl 122, id 36783, offset 0, flags [none], proto TCP (6), length 83)
    172.217.1.174.443 > 192.168.0.120.61442: Flags [P.], cksum 0x94f4 (correct), seq 69:100, ack 95, win 318, options [nop,nop,TS val 1624634880 ecr 582110167], length 31
13:50:18.765916 IP (tos 0x0, ttl 122, id 36784, offset 0, flags [none], proto TCP (6), length 91)
    172.217.1.174.443 > 192.168.0.120.61442: Flags [P.], cksum 0x7665 (correct), seq 100:139, ack 95, win 318, options [nop,nop,TS val 1624634880 ecr 582110167], length 39
13:50:18.766193 IP (tos 0x0, ttl 63, id 48344, offset 0, flags [DF], proto TCP (6), length 52)
    192.168.0.120.61442 > 172.217.1.174.443: Flags [.], cksum 0x94d8 (correct), seq 95, ack 69, win 501, options [nop,nop,TS val 582110217 ecr 1624634879], length 0
13:50:18.766193 IP (tos 0x0, ttl 63, id 48345, offset 0, flags [DF], proto TCP (6), length 52)
    192.168.0.120.61442 > 172.217.1.174.443: Flags [.], cksum 0x94b8 (correct), seq 95, ack 100, win 501, options [nop,nop,TS val 582110217 ecr 1624634880], length 0
13:50:18.766204 IP (tos 0x0, ttl 63, id 48346, offset 0, flags [DF], proto TCP (6), length 52)
    192.168.0.120.61442 > 172.217.1.174.443: Flags [.], cksum 0x9491 (correct), seq 95, ack 139, win 501, options [nop,nop,TS val 582110217 ecr 1624634880], length 0
13:50:18.766332 IP (tos 0x0, ttl 63, id 48347, offset 0, flags [DF], proto TCP (6), length 91)
    192.168.0.120.61442 > 172.217.1.174.443: Flags [P.], cksum 0xf080 (correct), seq 95:134, ack 139, win 501, options [nop,nop,TS val 582110217 ecr 1624634880], length 39
13:50:18.766708 IP (tos 0x0, ttl 63, id 12416, offset 0, flags [DF], proto TCP (6), length 472)
    192.168.0.120.5740 > 172.217.1.174.443: Flags [P.], cksum 0xcda9 (correct), seq 1772068165:1772068585, ack 410718181, win 501, options [nop,nop,TS val 582110218 ecr 1955437501], length 420
13:50:18.766807 IP (tos 0x0, ttl 63, id 12417, offset 0, flags [DF], proto TCP (6), length 208)
    192.168.0.120.5740 > 172.217.1.174.443: Flags [P.], cksum 0x18f5 (correct), seq 420:576, ack 1, win 501, options [nop,nop,TS val 582110218 ecr 1955437501], length 156
13:50:18.775595 IP (tos 0x0, ttl 121, id 6901, offset 0, flags [none], proto TCP (6), length 52)
    172.217.1.174.443 > 192.168.0.120.5740: Flags [.], cksum 0x242c (correct), seq 1, ack 420, win 1050, options [nop,nop,TS val 1955443317 ecr 582110218], length 0
13:50:18.776636 IP (tos 0x0, ttl 121, id 6902, offset 0, flags [none], proto TCP (6), length 52)
    172.217.1.174.443 > 192.168.0.120.5740: Flags [.], cksum 0x2390 (correct), seq 1, ack 576, win 1050, options [nop,nop,TS val 1955443317 ecr 582110218], length 0
13:50:18.777184 IP (tos 0x0, ttl 122, id 36802, offset 0, flags [none], proto TCP (6), length 52)
    172.217.1.174.443 > 192.168.0.120.61442: Flags [.], cksum 0x950c (correct), seq 139, ack 134, win 318, options [nop,nop,TS val 1624634901 ecr 582110217], length 0
13:50:19.005344 IP (tos 0x0, ttl 121, id 7358, offset 0, flags [none], proto TCP (6), length 449)
    172.217.1.174.443 > 192.168.0.120.5740: Flags [P.], cksum 0xf9da (correct), seq 1:398, ack 576, win 1050, options [nop,nop,TS val 1955443727 ecr 582110218], length 397
13:50:19.005346 IP (tos 0x0, ttl 121, id 7359, offset 0, flags [none], proto TCP (6), length 251)
    172.217.1.174.443 > 192.168.0.120.5740: Flags [P.], cksum 0x8787 (correct), seq 398:597, ack 576, win 1050, options [nop,nop,TS val 1955443727 ecr 582110218], length 199
13:50:19.005441 IP (tos 0x0, ttl 121, id 7360, offset 0, flags [none], proto TCP (6), length 137)
    172.217.1.174.443 > 192.168.0.120.5740: Flags [P.], cksum 0xb311 (correct), seq 597:682, ack 576, win 1050, options [nop,nop,TS val 1955443727 ecr 582110218], length 85
13:50:19.005569 IP (tos 0x0, ttl 63, id 12418, offset 0, flags [DF], proto TCP (6), length 52)
    192.168.0.120.5740 > 172.217.1.174.443: Flags [.], cksum 0x20e6 (correct), seq 576, ack 398, win 501, options [nop,nop,TS val 582110642 ecr 1955443727], length 0
13:50:19.005569 IP (tos 0x0, ttl 63, id 12419, offset 0, flags [DF], proto TCP (6), length 52)
    192.168.0.120.5740 > 172.217.1.174.443: Flags [.], cksum 0x201f (correct), seq 576, ack 597, win 501, options [nop,nop,TS val 582110642 ecr 1955443727], length 0
13:50:19.005581 IP (tos 0x0, ttl 63, id 12420, offset 0, flags [DF], proto TCP (6), length 52)
    192.168.0.120.5740 > 172.217.1.174.443: Flags [.], cksum 0x1fca (correct), seq 576, ack 682, win 501, options [nop,nop,TS val 582110642 ecr 1955443727], length 0
13:50:19.005877 IP (tos 0x0, ttl 121, id 7361, offset 0, flags [none], proto TCP (6), length 91)
    172.217.1.174.443 > 192.168.0.120.5740: Flags [P.], cksum 0x611b (correct), seq 682:721, ack 576, win 1050, options [nop,nop,TS val 1955443727 ecr 582110218], length 39
13:50:19.006131 IP (tos 0x0, ttl 63, id 12421, offset 0, flags [DF], proto TCP (6), length 52)
    192.168.0.120.5740 > 172.217.1.174.443: Flags [.], cksum 0x1fa2 (correct), seq 576, ack 721, win 501, options [nop,nop,TS val 582110643 ecr 1955443727], length 0
13:50:19.006164 IP (tos 0x0, ttl 63, id 12422, offset 0, flags [DF], proto TCP (6), length 91)
    192.168.0.120.5740 > 172.217.1.174.443: Flags [P.], cksum 0x68af (correct), seq 576:615, ack 721, win 501, options [nop,nop,TS val 582110643 ecr 1955443727], length 39
13:50:19.011167 IP (tos 0x0, ttl 121, id 7370, offset 0, flags [none], proto TCP (6), length 52)
    172.217.1.174.443 > 192.168.0.120.5740: Flags [.], cksum 0x1d4c (correct), seq 721, ack 615, win 1050, options [nop,nop,TS val 1955443737 ecr 582110643], length 0
13:50:19.318870 IP (tos 0x0, ttl 63, id 48348, offset 0, flags [DF], proto TCP (6), length 144)
    192.168.0.120.61442 > 172.217.1.174.443: Flags [P.], cksum 0xa492 (correct), seq 134:226, ack 139, win 501, options [nop,nop,TS val 582111198 ecr 1624634901], length 92
13:50:19.323880 IP (tos 0x0, ttl 122, id 37393, offset 0, flags [none], proto TCP (6), length 52)
    172.217.1.174.443 > 192.168.0.120.61442: Flags [.], cksum 0x8d10 (correct), seq 139, ack 226, win 318, options [nop,nop,TS val 1624635872 ecr 582111198], length 0
13:50:19.343592 IP (tos 0x0, ttl 122, id 37416, offset 0, flags [none], proto TCP (6), length 120)
    172.217.1.174.443 > 192.168.0.120.61442: Flags [P.], cksum 0x1622 (correct), seq 139:207, ack 226, win 318, options [nop,nop,TS val 1624635906 ecr 582111198], length 68
13:50:19.343854 IP (tos 0x0, ttl 122, id 37417, offset 0, flags [none], proto TCP (6), length 83)
    172.217.1.174.443 > 192.168.0.120.61442: Flags [P.], cksum 0xc988 (correct), seq 207:238, ack 226, win 318, options [nop,nop,TS val 1624635907 ecr 582111198], length 31
13:50:19.343864 IP (tos 0x0, ttl 122, id 37418, offset 0, flags [none], proto TCP (6), length 91)
    172.217.1.174.443 > 192.168.0.120.61442: Flags [P.], cksum 0x5991 (correct), seq 238:277, ack 226, win 318, options [nop,nop,TS val 1624635907 ecr 582111198], length 39
13:50:19.343866 IP (tos 0x0, ttl 63, id 48349, offset 0, flags [DF], proto TCP (6), length 52)
    192.168.0.120.61442 > 172.217.1.174.443: Flags [.], cksum 0x8bc6 (correct), seq 226, ack 207, win 501, options [nop,nop,TS val 582111243 ecr 1624635906], length 0
13:50:19.344118 IP (tos 0x0, ttl 63, id 48350, offset 0, flags [DF], proto TCP (6), length 52)
    192.168.0.120.61442 > 172.217.1.174.443: Flags [.], cksum 0x8ba6 (correct), seq 226, ack 238, win 501, options [nop,nop,TS val 582111243 ecr 1624635907], length 0
13:50:19.344118 IP (tos 0x0, ttl 63, id 48351, offset 0, flags [DF], proto TCP (6), length 52)
    192.168.0.120.61442 > 172.217.1.174.443: Flags [.], cksum 0x8b7f (correct), seq 226, ack 277, win 501, options [nop,nop,TS val 582111243 ecr 1624635907], length 0
13:50:19.344172 IP (tos 0x0, ttl 63, id 48352, offset 0, flags [DF], proto TCP (6), length 91)
    192.168.0.120.61442 > 172.217.1.174.443: Flags [P.], cksum 0x1804 (correct), seq 226:265, ack 277, win 501, options [nop,nop,TS val 582111243 ecr 1624635907], length 39
13:50:19.344494 IP (tos 0x0, ttl 63, id 12423, offset 0, flags [DF], proto TCP (6), length 348)
    192.168.0.120.5740 > 172.217.1.174.443: Flags [P.], cksum 0x32d0 (correct), seq 615:911, ack 721, win 501, options [nop,nop,TS val 582111244 ecr 1955443737], length 296
13:50:19.344525 IP (tos 0x0, ttl 63, id 12424, offset 0, flags [DF], proto TCP (6), length 745)
    192.168.0.120.5740 > 172.217.1.174.443: Flags [P.], cksum 0x9011 (correct), seq 911:1604, ack 721, win 501, options [nop,nop,TS val 582111244 ecr 1955443737], length 693
13:50:19.344645 IP (tos 0x0, ttl 63, id 12425, offset 0, flags [DF], proto TCP (6), length 670)
    192.168.0.120.5740 > 172.217.1.174.443: Flags [P.], cksum 0x5953 (correct), seq 1604:2222, ack 721, win 501, options [nop,nop,TS val 582111244 ecr 1955443737], length 618
13:50:19.352377 IP (tos 0x0, ttl 121, id 7668, offset 0, flags [none], proto TCP (6), length 52)
    172.217.1.174.443 > 192.168.0.120.5740: Flags [.], cksum 0x176d (correct), seq 721, ack 911, win 1050, options [nop,nop,TS val 1955444343 ecr 582111244], length 0
13:50:19.352379 IP (tos 0x0, ttl 121, id 7669, offset 0, flags [none], proto TCP (6), length 52)
    172.217.1.174.443 > 192.168.0.120.5740: Flags [.], cksum 0x14b9 (correct), seq 721, ack 1604, win 1049, options [nop,nop,TS val 1955444343 ecr 582111244], length 0
13:50:19.352478 IP (tos 0x0, ttl 121, id 7670, offset 0, flags [none], proto TCP (6), length 52)
    172.217.1.174.443 > 192.168.0.120.5740: Flags [.], cksum 0x124e (correct), seq 721, ack 2222, win 1050, options [nop,nop,TS val 1955444343 ecr 582111244], length 0
13:50:19.354869 IP (tos 0x0, ttl 122, id 37426, offset 0, flags [none], proto TCP (6), length 52)
    172.217.1.174.443 > 192.168.0.120.61442: Flags [.], cksum 0x8bfb (correct), seq 277, ack 265, win 318, options [nop,nop,TS val 1624635927 ecr 582111243], length 0
13:50:19.371404 IP (tos 0x0, ttl 121, id 7700, offset 0, flags [none], proto TCP (6), length 448)
    172.217.1.174.443 > 192.168.0.120.5740: Flags [P.], cksum 0x678c (correct), seq 721:1117, ack 2222, win 1050, options [nop,nop,TS val 1955444377 ecr 582111244], length 396
13:50:19.371480 IP (tos 0x0, ttl 121, id 7701, offset 0, flags [none], proto TCP (6), length 253)
    172.217.1.174.443 > 192.168.0.120.5740: Flags [P.], cksum 0xc6e9 (correct), seq 1117:1318, ack 2222, win 1050, options [nop,nop,TS val 1955444377 ecr 582111244], length 201
13:50:19.371751 IP (tos 0x0, ttl 121, id 7702, offset 0, flags [none], proto TCP (6), length 153)
    172.217.1.174.443 > 192.168.0.120.5740: Flags [P.], cksum 0xaf88 (correct), seq 1318:1419, ack 2222, win 1050, options [nop,nop,TS val 1955444378 ecr 582111244], length 101
13:50:19.371753 IP (tos 0x0, ttl 121, id 7703, offset 0, flags [none], proto TCP (6), length 91)
    172.217.1.174.443 > 192.168.0.120.5740: Flags [P.], cksum 0xf3aa (correct), seq 1419:1458, ack 2222, win 1050, options [nop,nop,TS val 1955444378 ecr 582111244], length 39
13:50:19.371805 IP (tos 0x0, ttl 63, id 12426, offset 0, flags [DF], proto TCP (6), length 52)
    192.168.0.120.5740 > 172.217.1.174.443: Flags [.], cksum 0x11cc (correct), seq 2222, ack 1318, win 501, options [nop,nop,TS val 582111292 ecr 1955444377], length 0
13:50:19.372029 IP (tos 0x0, ttl 63, id 12427, offset 0, flags [DF], proto TCP (6), length 52)
    192.168.0.120.5740 > 172.217.1.174.443: Flags [.], cksum 0x113e (correct), seq 2222, ack 1458, win 501, options [nop,nop,TS val 582111293 ecr 1955444378], length 0
13:50:19.372029 IP (tos 0x0, ttl 63, id 12428, offset 0, flags [DF], proto TCP (6), length 91)
    192.168.0.120.5740 > 172.217.1.174.443: Flags [P.], cksum 0xceb1 (correct), seq 2222:2261, ack 1458, win 501, options [nop,nop,TS val 582111293 ecr 1955444378], length 39
13:50:19.382379 IP (tos 0x0, ttl 121, id 7720, offset 0, flags [none], proto TCP (6), length 52)
    172.217.1.174.443 > 192.168.0.120.5740: Flags [.], cksum 0x0ee0 (correct), seq 1458, ack 2261, win 1050, options [nop,nop,TS val 1955444396 ecr 582111293], length 0
13:50:20.415859 IP (tos 0x0, ttl 63, id 21588, offset 0, flags [DF], proto TCP (6), length 91)
    192.168.0.120.2966 > 172.217.165.5.443: Flags [P.], cksum 0xcda9 (correct), seq 4210800001:4210800040, ack 3638509353, win 933, options [nop,nop,TS val 1814417496 ecr 1005177972], length 39
13:50:20.420850 IP (tos 0x0, ttl 121, id 50299, offset 0, flags [none], proto TCP (6), length 91)
    172.217.165.5.443 > 192.168.0.120.2966: Flags [P.], cksum 0x5bf8 (correct), seq 1:40, ack 39, win 1050, options [nop,nop,TS val 1005236423 ecr 1814417496], length 39
13:50:20.421154 IP (tos 0x0, ttl 63, id 21589, offset 0, flags [DF], proto TCP (6), length 52)
    192.168.0.120.2966 > 172.217.165.5.443: Flags [.], cksum 0x60ba (correct), seq 39, ack 40, win 933, options [nop,nop,TS val 1814417505 ecr 1005236423], length 0
13:50:21.016078 IP (tos 0x0, ttl 64, id 11195, offset 0, flags [none], proto ICMP (1), length 28)
    192.168.0.120 > 192.168.0.1: ICMP echo request, id 1535, seq 582, length 8
13:50:21.016776 IP (tos 0x0, ttl 64, id 302, offset 0, flags [none], proto ICMP (1), length 28)
    192.168.0.1 > 192.168.0.120: ICMP echo reply, id 1535, seq 582, length 8
13:50:21.289139 IP (tos 0x0, ttl 119, id 34433, offset 0, flags [none], proto TCP (6), length 105)
    172.217.197.189.443 > 192.168.0.120.47887: Flags [P.], cksum 0x8bf6 (correct), seq 2554888719:2554888772, ack 4165502759, win 621, options [nop,nop,TS val 3680534780 ecr 116124436], length 53
13:50:21.289422 IP (tos 0x0, ttl 63, id 56671, offset 0, flags [DF], proto TCP (6), length 52)
    192.168.0.120.47887 > 172.217.197.189.443: Flags [.], cksum 0x4224 (correct), seq 1, ack 53, win 501, options [nop,nop,TS val 116147419 ecr 3680534780], length 0
13:50:22.357103 IP (tos 0x0, ttl 64, id 8195, offset 0, flags [none], proto UDP (17), length 80)
    192.168.0.120.38642 > 1.1.1.1.53: [udp sum ok] 37793+ [1au] A? googlemail.l.google.com. ar: . OPT UDPsize=1472 DO (52)
13:50:22.357456 IP (tos 0x0, ttl 63, id 21590, offset 0, flags [DF], proto TCP (6), length 1420)
    192.168.0.120.2966 > 172.217.165.5.443: Flags [.], cksum 0xe9f6 (correct), seq 39:1407, ack 40, win 933, options [nop,nop,TS val 1814420944 ecr 1005236423], length 1368
13:50:22.357456 IP (tos 0x0, ttl 63, id 21591, offset 0, flags [DF], proto TCP (6), length 269)
    192.168.0.120.2966 > 172.217.165.5.443: Flags [P.], cksum 0x41cb (correct), seq 1407:1624, ack 40, win 933, options [nop,nop,TS val 1814420944 ecr 1005236423], length 217
13:50:22.357470 IP (tos 0x0, ttl 63, id 21592, offset 0, flags [DF], proto TCP (6), length 160)
    192.168.0.120.2966 > 172.217.165.5.443: Flags [P.], cksum 0x02bd (correct), seq 1624:1732, ack 40, win 933, options [nop,nop,TS val 1814420944 ecr 1005236423], length 108
13:50:22.367015 IP (tos 0x0, ttl 58, id 58308, offset 0, flags [DF], proto UDP (17), length 96)
    1.1.1.1.53 > 192.168.0.120.38642: [udp sum ok] 37793 q: A? googlemail.l.google.com. 1/0/1 googlemail.l.google.com. A 172.217.1.165 ar: . OPT UDPsize=1232 DO (68)
13:50:22.368227 IP (tos 0x0, ttl 121, id 52154, offset 0, flags [none], proto TCP (6), length 52)
    172.217.165.5.443 > 192.168.0.120.2966: Flags [.], cksum 0x3f24 (correct), seq 40, ack 1624, win 1050, options [nop,nop,TS val 1005239880 ecr 1814420944], length 0
13:50:22.369548 IP (tos 0x0, ttl 121, id 52157, offset 0, flags [none], proto TCP (6), length 52)
    172.217.165.5.443 > 192.168.0.120.2966: Flags [.], cksum 0x3eb3 (correct), seq 40, ack 1732, win 1050, options [nop,nop,TS val 1005239885 ecr 1814420944], length 0
13:50:22.613179 IP (tos 0x0, ttl 121, id 52421, offset 0, flags [none], proto TCP (6), length 452)
    172.217.165.5.443 > 192.168.0.120.2966: Flags [P.], cksum 0x0cf6 (correct), seq 40:440, ack 1732, win 1050, options [nop,nop,TS val 1005240319 ecr 1814420944], length 400
13:50:22.613427 IP (tos 0x0, ttl 63, id 21593, offset 0, flags [DF], proto TCP (6), length 52)
    192.168.0.120.2966 > 172.217.165.5.443: Flags [.], cksum 0x3a23 (correct), seq 1732, ack 440, win 930, options [nop,nop,TS val 1814421398 ecr 1005240319], length 0
13:50:22.613762 IP (tos 0x0, ttl 121, id 52422, offset 0, flags [none], proto TCP (6), length 483)
    172.217.165.5.443 > 192.168.0.120.2966: Flags [P.], cksum 0x0733 (correct), seq 440:871, ack 1732, win 1050, options [nop,nop,TS val 1005240320 ecr 1814420944], length 431
13:50:22.613764 IP (tos 0x0, ttl 121, id 52423, offset 0, flags [none], proto TCP (6), length 138)
    172.217.165.5.443 > 192.168.0.120.2966: Flags [P.], cksum 0x7fa6 (correct), seq 871:957, ack 1732, win 1050, options [nop,nop,TS val 1005240320 ecr 1814420944], length 86
13:50:22.614010 IP (tos 0x0, ttl 63, id 21594, offset 0, flags [DF], proto TCP (6), length 52)
    192.168.0.120.2966 > 172.217.165.5.443: Flags [.], cksum 0x3875 (correct), seq 1732, ack 871, win 927, options [nop,nop,TS val 1814421399 ecr 1005240320], length 0
13:50:22.614010 IP (tos 0x0, ttl 63, id 21595, offset 0, flags [DF], proto TCP (6), length 52)
    192.168.0.120.2966 > 172.217.165.5.443: Flags [.], cksum 0x381f (correct), seq 1732, ack 957, win 927, options [nop,nop,TS val 1814421399 ecr 1005240320], length 0
13:50:22.615233 IP (tos 0x0, ttl 121, id 52425, offset 0, flags [none], proto TCP (6), length 92)
    172.217.165.5.443 > 192.168.0.120.2966: Flags [P.], cksum 0x7be6 (correct), seq 957:997, ack 1732, win 1050, options [nop,nop,TS val 1005240322 ecr 1814420944], length 40
13:50:22.615235 IP (tos 0x0, ttl 121, id 52426, offset 0, flags [none], proto TCP (6), length 91)
    172.217.165.5.443 > 192.168.0.120.2966: Flags [P.], cksum 0x1351 (correct), seq 997:1036, ack 1732, win 1050, options [nop,nop,TS val 1005240322 ecr 1814420944], length 39
13:50:22.615483 IP (tos 0x0, ttl 63, id 21596, offset 0, flags [DF], proto TCP (6), length 52)
    192.168.0.120.2966 > 172.217.165.5.443: Flags [.], cksum 0x37ef (correct), seq 1732, ack 997, win 930, options [nop,nop,TS val 1814421402 ecr 1005240322], length 0
13:50:22.615483 IP (tos 0x0, ttl 63, id 21597, offset 0, flags [DF], proto TCP (6), length 52)
    192.168.0.120.2966 > 172.217.165.5.443: Flags [.], cksum 0x37c8 (correct), seq 1732, ack 1036, win 930, options [nop,nop,TS val 1814421402 ecr 1005240322], length 0
13:50:22.615545 IP (tos 0x0, ttl 63, id 21598, offset 0, flags [DF], proto TCP (6), length 91)
    192.168.0.120.2966 > 172.217.165.5.443: Flags [P.], cksum 0x686d (correct), seq 1732:1771, ack 1036, win 933, options [nop,nop,TS val 1814421402 ecr 1005240322], length 39
13:50:22.622964 IP (tos 0x0, ttl 121, id 52430, offset 0, flags [none], proto TCP (6), length 52)
    172.217.165.5.443 > 192.168.0.120.2966: Flags [.], cksum 0x371b (correct), seq 1036, ack 1771, win 1050, options [nop,nop,TS val 1005240336 ecr 1814421402], length 0
13:50:22.680657 IP (tos 0x0, ttl 119, id 36106, offset 0, flags [none], proto TCP (6), length 105)
    172.217.197.189.443 > 192.168.0.120.47887: Flags [P.], cksum 0x9256 (correct), seq 53:106, ack 1, win 621, options [nop,nop,TS val 3680537250 ecr 116147419], length 53
13:50:22.680961 IP (tos 0x0, ttl 63, id 56672, offset 0, flags [DF], proto TCP (6), length 52)
    192.168.0.120.47887 > 172.217.197.189.443: Flags [.], cksum 0x2ea2 (correct), seq 1, ack 106, win 501, options [nop,nop,TS val 116149890 ecr 3680537250], length 0
13:50:22.687171 IP (tos 0x0, ttl 64, id 57484, offset 0, flags [none], proto UDP (17), length 84)
    192.168.0.120.36898 > 1.1.1.1.53: [udp sum ok] 59764+ [1au] A? chat-pa.clients6.google.com. ar: . OPT UDPsize=1472 DO (56)
13:50:22.687228 IP (tos 0x0, ttl 64, id 30055, offset 0, flags [none], proto UDP (17), length 84)
    192.168.0.120.40993 > 1.1.1.1.53: [udp sum ok] 18576+ [1au] AAAA? chat-pa.clients6.google.com. ar: . OPT UDPsize=1472 DO (56)
13:50:22.696159 IP (tos 0x0, ttl 58, id 60336, offset 0, flags [DF], proto UDP (17), length 100)
    1.1.1.1.53 > 192.168.0.120.36898: [udp sum ok] 59764 q: A? chat-pa.clients6.google.com. 1/0/1 chat-pa.clients6.google.com. A 172.217.164.202 ar: . OPT UDPsize=1232 DO (72)
13:50:22.696761 IP (tos 0x0, ttl 63, id 54138, offset 0, flags [DF], proto TCP (6), length 60)
    192.168.0.120.28002 > 172.217.164.202.443: Flags [S], cksum 0xeb17 (correct), seq 2734784868, win 64240, options [mss 1460,sackOK,TS val 2624593727 ecr 0,nop,wscale 7], length 0
13:50:22.696789 IP (tos 0x0, ttl 63, id 925, offset 0, flags [DF], proto TCP (6), length 60)
    192.168.0.120.47313 > 172.217.164.202.443: Flags [S], cksum 0xf8ec (correct), seq 2150845165, win 64240, options [mss 1460,sackOK,TS val 2624593728 ecr 0,nop,wscale 7], length 0
13:50:22.699552 IP (tos 0x0, ttl 58, id 44526, offset 0, flags [DF], proto UDP (17), length 112)
    1.1.1.1.53 > 192.168.0.120.40993: [udp sum ok] 18576 q: AAAA? chat-pa.clients6.google.com. 1/0/1 chat-pa.clients6.google.com. AAAA 2607:f8b0:400b:80f::200a ar: . OPT UDPsize=1232 DO (84)
13:50:22.703310 IP (tos 0x0, ttl 121, id 56612, offset 0, flags [none], proto TCP (6), length 60)
    172.217.164.202.443 > 192.168.0.120.28002: Flags [S.], cksum 0xbc66 (correct), seq 440365427, ack 2734784869, win 60192, options [mss 1380,sackOK,TS val 3740652566 ecr 2624593727,nop,wscale 8], length 0
13:50:22.703564 IP (tos 0x0, ttl 63, id 54139, offset 0, flags [DF], proto TCP (6), length 52)
    192.168.0.120.28002 > 172.217.164.202.443: Flags [.], cksum 0xd401 (correct), seq 1, ack 1, win 502, options [nop,nop,TS val 2624593740 ecr 3740652566], length 0
13:50:22.704723 IP (tos 0x0, ttl 63, id 54140, offset 0, flags [DF], proto TCP (6), length 699)
    192.168.0.120.28002 > 172.217.164.202.443: Flags [P.], cksum 0x526a (correct), seq 1:648, ack 1, win 502, options [nop,nop,TS val 2624593741 ecr 3740652566], length 647
13:50:22.705520 IP (tos 0x0, ttl 122, id 3543, offset 0, flags [none], proto TCP (6), length 60)
    172.217.164.202.443 > 192.168.0.120.47313: Flags [S.], cksum 0xfd52 (correct), seq 1062689027, ack 2150845166, win 60192, options [mss 1380,sackOK,TS val 3302207097 ecr 2624593728,nop,wscale 8], length 0
13:50:22.705776 IP (tos 0x0, ttl 63, id 926, offset 0, flags [DF], proto TCP (6), length 52)
    192.168.0.120.47313 > 172.217.164.202.443: Flags [.], cksum 0x14ec (correct), seq 1, ack 1, win 502, options [nop,nop,TS val 2624593743 ecr 3302207097], length 0
13:50:22.707027 IP (tos 0x0, ttl 63, id 927, offset 0, flags [DF], proto TCP (6), length 699)
    192.168.0.120.47313 > 172.217.164.202.443: Flags [P.], cksum 0x5bb8 (correct), seq 1:648, ack 1, win 502, options [nop,nop,TS val 2624593746 ecr 3302207097], length 647
13:50:22.714996 IP (tos 0x0, ttl 121, id 56628, offset 0, flags [none], proto TCP (6), length 52)
    172.217.164.202.443 > 192.168.0.120.28002: Flags [.], cksum 0xd26a (correct), seq 1, ack 648, win 241, options [nop,nop,TS val 3740652586 ecr 2624593741], length 0
13:50:22.716136 IP (tos 0x0, ttl 122, id 3545, offset 0, flags [none], proto TCP (6), length 52)
    172.217.164.202.443 > 192.168.0.120.47313: Flags [.], cksum 0x1357 (correct), seq 1, ack 648, win 241, options [nop,nop,TS val 3302207113 ecr 2624593746], length 0
13:50:22.728123 IP (tos 0x0, ttl 121, id 56643, offset 0, flags [none], proto TCP (6), length 264)
    172.217.164.202.443 > 192.168.0.120.28002: Flags [P.], cksum 0xa794 (correct), seq 1:213, ack 648, win 241, options [nop,nop,TS val 3740652607 ecr 2624593741], length 212
13:50:22.728399 IP (tos 0x0, ttl 63, id 54141, offset 0, flags [DF], proto TCP (6), length 52)
    192.168.0.120.28002 > 172.217.164.202.443: Flags [.], cksum 0xd052 (correct), seq 648, ack 213, win 501, options [nop,nop,TS val 2624593784 ecr 3740652607], length 0
13:50:22.728937 IP (tos 0x0, ttl 122, id 3552, offset 0, flags [none], proto TCP (6), length 264)
    172.217.164.202.443 > 192.168.0.120.47313: Flags [P.], cksum 0x58c9 (correct), seq 1:213, ack 648, win 241, options [nop,nop,TS val 3302207135 ecr 2624593746], length 212
13:50:22.729037 IP (tos 0x0, ttl 63, id 54142, offset 0, flags [DF], proto TCP (6), length 116)
    192.168.0.120.28002 > 172.217.164.202.443: Flags [P.], cksum 0xb115 (correct), seq 648:712, ack 213, win 501, options [nop,nop,TS val 2624593785 ecr 3740652607], length 64
13:50:22.729168 IP (tos 0x0, ttl 63, id 928, offset 0, flags [DF], proto TCP (6), length 52)
    192.168.0.120.47313 > 172.217.164.202.443: Flags [.], cksum 0x1142 (correct), seq 648, ack 213, win 501, options [nop,nop,TS val 2624593785 ecr 3302207135], length 0
13:50:22.731112 IP (tos 0x0, ttl 63, id 929, offset 0, flags [DF], proto TCP (6), length 116)
    192.168.0.120.47313 > 172.217.164.202.443: Flags [P.], cksum 0xa7d0 (correct), seq 648:712, ack 213, win 501, options [nop,nop,TS val 2624593788 ecr 3302207135], length 64
13:50:22.732581 IP (tos 0x0, ttl 63, id 54143, offset 0, flags [DF], proto TCP (6), length 222)
    192.168.0.120.28002 > 172.217.164.202.443: Flags [P.], cksum 0xfe9b (correct), seq 712:882, ack 213, win 501, options [nop,nop,TS val 2624593791 ecr 3740652607], length 170
13:50:22.733311 IP (tos 0x0, ttl 63, id 930, offset 0, flags [DF], proto TCP (6), length 222)
    192.168.0.120.47313 > 172.217.164.202.443: Flags [P.], cksum 0x43e0 (correct), seq 712:882, ack 213, win 501, options [nop,nop,TS val 2624593792 ecr 3302207135], length 170
13:50:22.733369 IP (tos 0x0, ttl 63, id 931, offset 0, flags [DF], proto TCP (6), length 975)
    192.168.0.120.47313 > 172.217.164.202.443: Flags [P.], cksum 0xb691 (correct), seq 882:1805, ack 213, win 501, options [nop,nop,TS val 2624593792 ecr 3302207135], length 923
13:50:22.735599 IP (tos 0x0, ttl 121, id 56652, offset 0, flags [none], proto TCP (6), length 632)
    172.217.164.202.443 > 192.168.0.120.28002: Flags [P.], cksum 0xf46d (correct), seq 213:793, ack 712, win 241, options [nop,nop,TS val 3740652624 ecr 2624593785], length 580
13:50:22.735929 IP (tos 0x0, ttl 63, id 54144, offset 0, flags [DF], proto TCP (6), length 52)
    192.168.0.120.28002 > 172.217.164.202.443: Flags [.], cksum 0xcd06 (correct), seq 882, ack 793, win 501, options [nop,nop,TS val 2624593797 ecr 3740652624], length 0
13:50:22.736121 IP (tos 0x0, ttl 63, id 54145, offset 0, flags [DF], proto TCP (6), length 83)
    192.168.0.120.28002 > 172.217.164.202.443: Flags [P.], cksum 0x3512 (correct), seq 882:913, ack 793, win 501, options [nop,nop,TS val 2624593797 ecr 3740652624], length 31
13:50:22.738621 IP (tos 0x0, ttl 121, id 56654, offset 0, flags [none], proto TCP (6), length 83)
    172.217.164.202.443 > 192.168.0.120.28002: Flags [P.], cksum 0x7578 (correct), seq 793:824, ack 882, win 246, options [nop,nop,TS val 3740652630 ecr 2624593791], length 31
13:50:22.738892 IP (tos 0x0, ttl 122, id 3565, offset 0, flags [none], proto TCP (6), length 632)
    172.217.164.202.443 > 192.168.0.120.47313: Flags [P.], cksum 0xc637 (correct), seq 213:793, ack 712, win 241, options [nop,nop,TS val 3302207157 ecr 2624593788], length 580
13:50:22.738900 IP (tos 0x0, ttl 63, id 54146, offset 0, flags [DF], proto TCP (6), length 52)
    192.168.0.120.28002 > 172.217.164.202.443: Flags [.], cksum 0xccbd (correct), seq 913, ack 824, win 501, options [nop,nop,TS val 2624593802 ecr 3740652630], length 0
13:50:22.739022 IP (tos 0x0, ttl 63, id 932, offset 0, flags [DF], proto TCP (6), length 52)
    192.168.0.120.47313 > 172.217.164.202.443: Flags [.], cksum 0x0a51 (correct), seq 1805, ack 793, win 501, options [nop,nop,TS val 2624593803 ecr 3302207157], length 0
13:50:22.739147 IP (tos 0x0, ttl 63, id 933, offset 0, flags [DF], proto TCP (6), length 83)
    192.168.0.120.47313 > 172.217.164.202.443: Flags [P.], cksum 0x2430 (correct), seq 1805:1836, ack 793, win 501, options [nop,nop,TS val 2624593803 ecr 3302207157], length 31
13:50:22.742140 IP (tos 0x0, ttl 122, id 3568, offset 0, flags [none], proto TCP (6), length 52)
    172.217.164.202.443 > 192.168.0.120.47313: Flags [.], cksum 0x0b4e (correct), seq 793, ack 1805, win 253, options [nop,nop,TS val 3302207163 ecr 2624593792], length 0
13:50:22.742242 IP (tos 0x0, ttl 122, id 3569, offset 0, flags [none], proto TCP (6), length 83)
    172.217.164.202.443 > 192.168.0.120.47313: Flags [P.], cksum 0xd0af (correct), seq 793:824, ack 1805, win 253, options [nop,nop,TS val 3302207163 ecr 2624593792], length 31
13:50:22.742405 IP (tos 0x0, ttl 63, id 934, offset 0, flags [DF], proto TCP (6), length 52)
    192.168.0.120.47313 > 172.217.164.202.443: Flags [.], cksum 0x0a07 (correct), seq 1836, ack 824, win 501, options [nop,nop,TS val 2624593809 ecr 3302207163], length 0
13:50:22.745083 IP (tos 0x0, ttl 121, id 56662, offset 0, flags [none], proto TCP (6), length 52)
    172.217.164.202.443 > 192.168.0.120.28002: Flags [.], cksum 0xcdb6 (correct), seq 824, ack 913, win 246, options [nop,nop,TS val 3740652641 ecr 2624593797], length 0
13:50:22.748476 IP (tos 0x0, ttl 122, id 3571, offset 0, flags [none], proto TCP (6), length 52)
    172.217.164.202.443 > 192.168.0.120.47313: Flags [.], cksum 0x0afa (correct), seq 824, ack 1836, win 253, options [nop,nop,TS val 3302207174 ecr 2624593803], length 0
13:50:22.754719 IP (tos 0x0, ttl 122, id 3578, offset 0, flags [none], proto TCP (6), length 575)
    172.217.164.202.443 > 192.168.0.120.47313: Flags [P.], cksum 0x2ce8 (correct), seq 824:1347, ack 1836, win 253, options [nop,nop,TS val 3302207185 ecr 2624593803], length 523
13:50:22.754974 IP (tos 0x0, ttl 63, id 935, offset 0, flags [DF], proto TCP (6), length 52)
    192.168.0.120.47313 > 172.217.164.202.443: Flags [.], cksum 0x07d0 (correct), seq 1836, ack 1347, win 501, options [nop,nop,TS val 2624593831 ecr 3302207185], length 0
13:50:22.755277 IP (tos 0x0, ttl 122, id 3579, offset 0, flags [none], proto TCP (6), length 83)
    172.217.164.202.443 > 192.168.0.120.47313: Flags [P.], cksum 0xd1b0 (correct), seq 1347:1378, ack 1836, win 253, options [nop,nop,TS val 3302207186 ecr 2624593803], length 31
13:50:22.755279 IP (tos 0x0, ttl 122, id 3580, offset 0, flags [none], proto TCP (6), length 91)
    172.217.164.202.443 > 192.168.0.120.47313: Flags [P.], cksum 0xa4ab (correct), seq 1378:1417, ack 1836, win 253, options [nop,nop,TS val 3302207186 ecr 2624593803], length 39
13:50:22.755564 IP (tos 0x0, ttl 63, id 936, offset 0, flags [DF], proto TCP (6), length 52)
    192.168.0.120.47313 > 172.217.164.202.443: Flags [.], cksum 0x07af (correct), seq 1836, ack 1378, win 501, options [nop,nop,TS val 2624593832 ecr 3302207186], length 0
13:50:22.755564 IP (tos 0x0, ttl 63, id 937, offset 0, flags [DF], proto TCP (6), length 52)
    192.168.0.120.47313 > 172.217.164.202.443: Flags [.], cksum 0x0788 (correct), seq 1836, ack 1417, win 501, options [nop,nop,TS val 2624593832 ecr 3302207186], length 0
13:50:22.755674 IP (tos 0x0, ttl 63, id 938, offset 0, flags [DF], proto TCP (6), length 91)
    192.168.0.120.47313 > 172.217.164.202.443: Flags [P.], cksum 0xd343 (correct), seq 1836:1875, ack 1417, win 501, options [nop,nop,TS val 2624593832 ecr 3302207186], length 39
13:50:22.756311 IP (tos 0x0, ttl 63, id 54147, offset 0, flags [DF], proto TCP (6), length 1420)
    192.168.0.120.28002 > 172.217.164.202.443: Flags [.], cksum 0xfe3c (correct), seq 913:2281, ack 824, win 501, options [nop,nop,TS val 2624593833 ecr 3740652641], length 1368
13:50:22.756311 IP (tos 0x0, ttl 63, id 54148, offset 0, flags [DF], proto TCP (6), length 301)
    192.168.0.120.28002 > 172.217.164.202.443: Flags [P.], cksum 0x74ca (correct), seq 2281:2530, ack 824, win 501, options [nop,nop,TS val 2624593833 ecr 3740652641], length 249
13:50:22.756338 IP (tos 0x0, ttl 63, id 54149, offset 0, flags [DF], proto TCP (6), length 233)
    192.168.0.120.28002 > 172.217.164.202.443: Flags [P.], cksum 0x531c (correct), seq 2530:2711, ack 824, win 501, options [nop,nop,TS val 2624593833 ecr 3740652641], length 181
13:50:22.763021 IP (tos 0x0, ttl 121, id 56678, offset 0, flags [none], proto TCP (6), length 52)
    172.217.164.202.443 > 192.168.0.120.28002: Flags [.], cksum 0xc810 (correct), seq 824, ack 2281, win 256, options [nop,nop,TS val 3740652673 ecr 2624593833], length 0
13:50:22.763023 IP (tos 0x0, ttl 121, id 56679, offset 0, flags [none], proto TCP (6), length 52)
    172.217.164.202.443 > 192.168.0.120.28002: Flags [.], cksum 0xc70c (correct), seq 824, ack 2530, win 267, options [nop,nop,TS val 3740652673 ecr 2624593833], length 0
13:50:22.763024 IP (tos 0x0, ttl 121, id 56680, offset 0, flags [none], proto TCP (6), length 52)
    172.217.164.202.443 > 192.168.0.120.28002: Flags [.], cksum 0xc64c (correct), seq 824, ack 2711, win 278, options [nop,nop,TS val 3740652673 ecr 2624593833], length 0
13:50:22.765399 IP (tos 0x0, ttl 122, id 3587, offset 0, flags [none], proto TCP (6), length 52)
    172.217.164.202.443 > 192.168.0.120.47313: Flags [.], cksum 0x0847 (correct), seq 1417, ack 1875, win 253, options [nop,nop,TS val 3302207204 ecr 2624593832], length 0
13:50:22.787203 IP (tos 0x0, ttl 121, id 56686, offset 0, flags [none], proto TCP (6), length 900)
    172.217.164.202.443 > 192.168.0.120.28002: Flags [P.], cksum 0xb6cc (correct), seq 824:1672, ack 2711, win 278, options [nop,nop,TS val 3740652716 ecr 2624593833], length 848
13:50:22.787205 IP (tos 0x0, ttl 121, id 56687, offset 0, flags [none], proto TCP (6), length 398)
    172.217.164.202.443 > 192.168.0.120.28002: Flags [P.], cksum 0x4e8c (correct), seq 1672:2018, ack 2711, win 278, options [nop,nop,TS val 3740652716 ecr 2624593833], length 346
13:50:22.787206 IP (tos 0x0, ttl 121, id 56688, offset 0, flags [none], proto TCP (6), length 91)
    172.217.164.202.443 > 192.168.0.120.28002: Flags [P.], cksum 0x7402 (correct), seq 2018:2057, ack 2711, win 278, options [nop,nop,TS val 3740652716 ecr 2624593833], length 39
13:50:22.787537 IP (tos 0x0, ttl 63, id 54150, offset 0, flags [DF], proto TCP (6), length 52)
    192.168.0.120.28002 > 172.217.164.202.443: Flags [.], cksum 0xc060 (correct), seq 2711, ack 2018, win 501, options [nop,nop,TS val 2624593889 ecr 3740652716], length 0
13:50:22.787873 IP (tos 0x0, ttl 63, id 54151, offset 0, flags [DF], proto TCP (6), length 91)
    192.168.0.120.28002 > 172.217.164.202.443: Flags [P.], cksum 0x611b (correct), seq 2711:2750, ack 2057, win 501, options [nop,nop,TS val 2624593889 ecr 3740652716], length 39
13:50:22.798020 IP (tos 0x0, ttl 121, id 56690, offset 0, flags [none], proto TCP (6), length 52)
    172.217.164.202.443 > 192.168.0.120.28002: Flags [.], cksum 0xc0de (correct), seq 2057, ack 2750, win 278, options [nop,nop,TS val 3740652735 ecr 2624593889], length 0
13:50:23.851383 IP (tos 0x0, ttl 63, id 24066, offset 0, flags [DF], proto TCP (6), length 60)
    192.168.0.120.29799 > 172.217.1.165.443: Flags [S], cksum 0x1f5c (correct), seq 1063343481, win 64240, options [mss 1460,sackOK,TS val 1029928372 ecr 0,nop,wscale 7], length 0
13:50:23.851600 IP (tos 0x0, ttl 63, id 35349, offset 0, flags [DF], proto TCP (6), length 60)
    192.168.0.120.46273 > 172.217.1.165.443: Flags [S], cksum 0xfe14 (correct), seq 362700841, win 64240, options [mss 1460,sackOK,TS val 1029928372 ecr 0,nop,wscale 7], length 0
13:50:23.860043 IP (tos 0x0, ttl 121, id 24384, offset 0, flags [none], proto TCP (6), length 60)
    172.217.1.165.443 > 192.168.0.120.29799: Flags [S.], cksum 0xde08 (correct), seq 3507119112, ack 1063343482, win 60192, options [mss 1380,sackOK,TS val 3458158126 ecr 1029928372,nop,wscale 8], length 0
13:50:23.860288 IP (tos 0x0, ttl 63, id 24067, offset 0, flags [DF], proto TCP (6), length 52)
    192.168.0.120.29799 > 172.217.1.165.443: Flags [.], cksum 0xf5a0 (correct), seq 1, ack 1, win 502, options [nop,nop,TS val 1029928388 ecr 3458158126], length 0
13:50:23.860978 IP (tos 0x0, ttl 63, id 24068, offset 0, flags [DF], proto TCP (6), length 691)
    192.168.0.120.29799 > 172.217.1.165.443: Flags [P.], cksum 0xba04 (correct), seq 1:640, ack 1, win 502, options [nop,nop,TS val 1029928389 ecr 3458158126], length 639
13:50:23.861380 IP (tos 0x0, ttl 121, id 5988, offset 0, flags [none], proto TCP (6), length 60)
    172.217.1.165.443 > 192.168.0.120.46273: Flags [S.], cksum 0x3b1c (correct), seq 2234893007, ack 362700842, win 60192, options [mss 1380,sackOK,TS val 2982009155 ecr 1029928372,nop,wscale 8], length 0
13:50:23.861672 IP (tos 0x0, ttl 63, id 35350, offset 0, flags [DF], proto TCP (6), length 52)
    192.168.0.120.46273 > 172.217.1.165.443: Flags [.], cksum 0x52b2 (correct), seq 1, ack 1, win 502, options [nop,nop,TS val 1029928390 ecr 2982009155], length 0
13:50:23.862390 IP (tos 0x0, ttl 63, id 35351, offset 0, flags [DF], proto TCP (6), length 691)
    192.168.0.120.46273 > 172.217.1.165.443: Flags [P.], cksum 0x595d (correct), seq 1:640, ack 1, win 502, options [nop,nop,TS val 1029928391 ecr 2982009155], length 639
13:50:23.871405 IP (tos 0x0, ttl 121, id 6007, offset 0, flags [none], proto TCP (6), length 52)
    172.217.1.165.443 > 192.168.0.120.46273: Flags [.], cksum 0x5123 (correct), seq 1, ack 640, win 241, options [nop,nop,TS val 2982009175 ecr 1029928391], length 0
13:50:23.872375 IP (tos 0x0, ttl 121, id 24385, offset 0, flags [none], proto TCP (6), length 52)
    172.217.1.165.443 > 192.168.0.120.29799: Flags [.], cksum 0xf40d (correct), seq 1, ack 640, win 241, options [nop,nop,TS val 3458158150 ecr 1029928389], length 0
13:50:23.883657 IP (tos 0x0, ttl 121, id 24387, offset 0, flags [none], proto TCP (6), length 264)
    172.217.1.165.443 > 192.168.0.120.29799: Flags [P.], cksum 0xcd9a (correct), seq 1:213, ack 640, win 241, options [nop,nop,TS val 3458158171 ecr 1029928389], length 212
13:50:23.883917 IP (tos 0x0, ttl 63, id 24069, offset 0, flags [DF], proto TCP (6), length 52)
    192.168.0.120.29799 > 172.217.1.165.443: Flags [.], cksum 0xf1f7 (correct), seq 640, ack 213, win 501, options [nop,nop,TS val 1029928430 ecr 3458158171], length 0
13:50:23.884298 IP (tos 0x0, ttl 63, id 24070, offset 0, flags [DF], proto TCP (6), length 116)
    192.168.0.120.29799 > 172.217.1.165.443: Flags [P.], cksum 0xab30 (correct), seq 640:704, ack 213, win 501, options [nop,nop,TS val 1029928430 ecr 3458158171], length 64
13:50:23.884754 IP (tos 0x0, ttl 121, id 6014, offset 0, flags [none], proto TCP (6), length 264)
    172.217.1.165.443 > 192.168.0.120.46273: Flags [P.], cksum 0x4061 (correct), seq 1:213, ack 640, win 241, options [nop,nop,TS val 2982009197 ecr 1029928391], length 212
13:50:23.884996 IP (tos 0x0, ttl 63, id 35352, offset 0, flags [DF], proto TCP (6), length 52)
    192.168.0.120.46273 > 172.217.1.165.443: Flags [.], cksum 0x4f0c (correct), seq 640, ack 213, win 501, options [nop,nop,TS val 1029928432 ecr 2982009197], length 0
13:50:23.884997 IP (tos 0x0, ttl 63, id 24071, offset 0, flags [DF], proto TCP (6), length 222)
    192.168.0.120.29799 > 172.217.1.165.443: Flags [P.], cksum 0xcbc6 (correct), seq 704:874, ack 213, win 501, options [nop,nop,TS val 1029928432 ecr 3458158171], length 170
13:50:23.885636 IP (tos 0x0, ttl 63, id 35353, offset 0, flags [DF], proto TCP (6), length 116)
    192.168.0.120.46273 > 172.217.1.165.443: Flags [P.], cksum 0x8698 (correct), seq 640:704, ack 213, win 501, options [nop,nop,TS val 1029928433 ecr 2982009197], length 64
13:50:23.886249 IP (tos 0x0, ttl 63, id 35354, offset 0, flags [DF], proto TCP (6), length 222)
